question_number,question_text,image,options,answer,explanation,QA type,knowledge topics,book label,level of difficulty,question type,share_context,share_image,pil_image,pil_share_image
1,"Under the contingent claim approach to the firm's capital structure, which of the following
statements is true? Assume the amount of senior debt, subordinated debt, and equity is
represented as F, U, and S, respectively.",[],"{'A': 'A.The value of\\nsubordinated debt is less than the value of senior debt.', 'B': 'B.Subordinated\\ndebt can be represented by a long call with exercise price of F and short\ncall\\nw', 'C': 'C.Subordinated\\ndebt behaves more like equity in distress and more like debt when the firm\nis\\nno', 'D': 'D.The value of\\nsubordinated debt is always greater than the value of equity.'}",C,"Statements a and d are not necessarily true as therelative amounts of senior and
subordinated debt can vary dramatically.Statement b is false. Subordinated debt has priority
after senior debt butahead of equity. Therefore, the subordinated claim is between senior debt,
F,and total debt, F + U. It follows that the subordinated debt can be modeled bya long call
option with strike price = F and a short call with strike price = F+ U (not U). Statement c is
correct. During financial distress, the equity valueis relatively small, and the subordinated
debt claim behaves more like equityas it is closer to receiving “residual” cash flows.
Similarly, when the firmvalue is relatively high, the subordinated debt claim behaves more like
traditionaldebt.",Knowledge reasoning QA,"Contingent claim analysis, capital structure, subordinated debt dynamics",Credit Risk Measurement and Management,difficult,text only,[],[],[],[]
2,"Harrison Michaels, FRM, an analyst at Hudson Risk Analytics, is discussing the default
sensitivities of equity, mezzanine, and senior tranches and makes the following statements.
Which of the following statements is(are) most likely correct? I. Default sensitivities are
largest close to the attachment point between tranches. II. Default sensitivities are computed
by shocking the credit default swap (CDS) default curve.",[],"{'A': 'A.I only.', 'B': 'B.II only.', 'C': 'C.Both I and II.', 'D': 'D.\xa0Neither I nor\\nII.'}",A,"Defaultsensitivities are computed by shocking various hypothetical default
probabilities.Default sensitivities are always positive although they will converge to zeroat
high default rates for all tranches. Default sensitivities are largest atvalues that create
losses close to the attachment points.",Knowledge reasoning QA,"Default Sensitivities, Tranche Structure, Credit Default Swaps (CDS)",Credit Risk Measurement and Management,difficult,text only,[],[],[],[]
3,"The rate parameter in the exponential distribution measures the rate at which it takes an
event to occur. In the context of waiting for a company to default, the rate parameter is known
as the hazard rate and indicates the rate at which default will arrive. Which of the following
statements about hazard rates (i.e., default intensity) is correct assuming a constant default
intensity of 0.2?",[],"{'A': 'A.1', 'B': 'B.The cumulative\\ndefault probability after 3 periods = e-(0.2)3', 'C': 'C.The conditional\\ndefault probability after 1 period = 2%.', 'D': 'D.The\\nunconditional default probability is memoryless.'}",D,"The cumulative probability of default after three periodsis: 1-e-(0.2)3. The
probability of default in the first period = 1-e-(0.2)1 = 18.1%. The default probability in the
second period is: 1- e-(0.2)2=33.0% - 18.1% = 14.9%. Thus, the conditional probability of
default after oneperiod = 14.9%/(1-18.1%) = 18.2%. It is the conditional default
probabilitythat is memoryless.",math reasoning QA,"Exponential Distribution, Hazard Rate, Default Probability",Credit Risk Measurement and Management,difficult,text only,[],[],[],[]
4,"Using the Merton model, calculate the current value of a firm's equity and debt given that
the current value of the firm is $100 million, the principal amount due in five years on the
zero-coupon bond is $100 million, the annual interest rate is 10%, and the volatility of the
firm is 20%.",[],"{'A': 'A.$100 million in\\ndebt and $0 in equity.', 'B': 'B.$60.65 million\\nin debt and $39.35 million in equity.', 'C': 'C.$58.38 million\\nin debt and $41.62 million in equity.', 'D': 'D.\xa0$32.59 million\\nin debt and $67.41 million in equity.'}",C,"$$
S_t = 100N(d) - (100)(0.6065)N\left(d - \sigma\sqrt{T - t}\right)
$$

$$
d = \frac{\ln\left(\frac{100}{(100)(0.6065)}\right)}{(0.20)\sqrt{5 - 0}} + \frac{1}{2}(0.20)\sqrt{5 - 0} = \frac{\ln(1.6488)}{0.4472} + \frac{1}{2}(0.4472) = 1.3418
$$

$$
S_t = 100N(1.3418) - (100)(0.6065)N(1.3418 - 0.4472)
$$

$$
S_t = 100(0.9101) - (60.65)(0.8144)
$$

$$
S_t = 91.01 - 49.39 = 41.62
$$

Therefore, the value of equity of the firm is $41.62$ million. Since the value of debt must be the difference between the firm’s value of $100$ million and the value of equity, the value of debt is $58.38$ million.",math reasoning QA,"Merton Model, Valuation of Debt and Equity, Volatility Measurement",Credit Risk Measurement and Management,difficult,text only,[],[],[],[]
5,"The following scenarios illustrate exposures for two trades with and without the impact of
netting. Given the below expected positive exposures (EPE), what is the corresponding netting
factor? Assume that the average correlation between exposures is 0.55.",['/Volumes/Jennie/Reasoning/FinMath/data/FRMLevel2/CreditRiskMeasurementandManagement/CreditRiskMeasurementandManagement_images/5u.png'],"{'A': 'A.0.55.', 'B': 'B.\xa00.67.', 'C': 'C.0.80.', 'D': 'D.1.25.'}",C,"The netting factor is computed as

$$
\text{netting factor} = \frac{\sqrt{n + n(n - 1)\bar{\rho}}}{n}
$$

where:

$n = \text{number of exposures}$

$\bar{\rho} = \text{average correlation}$

Netting factor = 

$$
\frac{\sqrt{5 + 5(5 - 1)0.55}}{5} = 0.8 \text{ or } 80\%
$$",math reasoning QA,"Netting agreements, Exposure at Default (EAD), Counterparty Credit Risk",Credit Risk Measurement and Management,difficult,text only,[],[],[<PIL.PngImagePlugin.PngImageFile image mode=RGB size=770x343 at 0x113F23220>],[]
6,"Asu Walia is a senior analyst working for a sell side company preparing research reports on
the mining sector. Walia noted that one of the companies he follows recently increased risk to
the firm's assets, which he expects will benefit equity holders to the detriment of debt
holders.  Which of the following concepts best describes the scenario in Walia's analysis?",[],"{'A': 'A.Coordination\\nfailures.', 'B': 'B.Adverse\\nselection.', 'C': 'C.Risk shifting.', 'D': 'D.\xa0Principal-agent\\nproblem.'}",C,"The scenario described by Walia relates to risk shifting.Risk shifting occurs when
risks and rewards are transferred from one group ofmarket participants to another group holding
different positions in the firm'scapital structure. In this case, risk to the firm's assets
would benefit equityholders to the detriment of debt holders who have fixed returns but
increased riskof loss.Coordination failures (collective actionproblems) occur when a group of
individuals were to benefit collectively ifthey all took a course of action; however, it would
not benefit an individualif she alone took the same course of action. Adverse selection occurs
whenparties to a transaction have asymmetric information. Principal-agent problemoccurs when a
principal hires an agent for specific duties, where the agent hasmore superior information than
the principal.",Knowledge reasoning QA,"Risk Shifting, Capital Structure, Asymmetric Information",Credit Risk Measurement and Management,difficult,text only,[],[],[],[]
7,"Advanced Pharmaceuticals is considering an investment in a very risky drug therapy
treatment.  If the investment is successful, Advanced Pharmaceuticals can earn substantial
profits. On the other hand, if the therapy treatments create long-term side-effects, the firm
will be subject to expensive litigation. How should Advanced Pharmaceuticals structure its
investment to minimize its cost of capital?",[],"{'A': 'A.Ring-fence the\\ninvestment so a special purpose entity (SPE) can issue debt at lower costs.', 'B': 'B.Ring-fence the\\ninvestment into a SPE so the parent company can increase transparency.', 'C': 'C.Securitize the\\ninvestment due to its predictable cash flows.', 'D': 'D.Sell the\\ninvestment in a true sale, increasing adverse selection.'}",B,"By ring-fencing the risky investment into its own SPE, theparent company can issue
debt at favorable terms because its remaining assetsare more transparent. The SPE would contain
a risky investment and wouldincrease the costs to issue debt on its own. The nature of the
investment doesnot have predictable cash flows like mortgages or auto loans. Placing the
investmentin a SPE with a true sale would legally separate the venture from the parent.
Thiswould increase transparency, decreasing adverse selection.",Knowledge reasoning QA,"Corporate finance, Risk management, Special purpose entities (SPE)",Credit Risk Measurement and Management,difficult,text only,[],[],[],[]
8,"Harris Smith, CFO of XYZ Bank Corp, is considering a $500 million loan securitization. He has
enlisted a well-respected structuring agent to help decide on the most beneficial structure.
XYZ is a $100 billion regional bank with a moderately strong balance sheet. Its current credit
rating on unsecured debt is BBB. It recently issued a secured bond issue with a credit rating
of A after ring-fencing certain assets. XYZ desires to minimize the cost of funds and achieve
AAA credit rating on the senior tranche of the new securitization. After reviewing the
financials of XYZ and forecasting future economic conditions, the structure has recommended an
arbitrage CDO with the following loss distributions: Equity tranche: 0-30%. Junior tranche: 30-
50% Smith should use which of the following CDO structures?",[],"{'A': 'A.Arbitrage CDO\\nwith $25 million equity trance.', 'B': 'B.\xa0Arbitrage CDO\\nwith $150 million equity tranche.', 'C': 'C.Balance sheet\\nCDO with $25 million equity tranche.', 'D': 'D.Balance sheet\\nCDO with $150 million equity tranche.'}",C,"SinceXYZ wants to securitize loans it originated, this fits the profile of a
balancesheet CDO. Also, the suggested loss distribution likely has too large of anequity
tranche. Hence, the smaller equity tranche of $25 million, whichrepresents 5% of the issue, is
more appropriate to still retain AAA rating ofsenior tranche.",knowledge reasoning QA,"Credit Ratings, Structured Finance, CDOs (Collateralized Debt Obligations)",Credit Risk Measurement and Management,difficult,text only,[],[],[],[]
9,"Which of the following statements regarding subprime mortgages is true? I.  Senior tranches
receive the highest return due to overcollateralization. II.  Corporate bonds and subprime
pools with the same credit rating will exhibit the same variation in losses.",[],"{'A': 'A.I only.', 'B': 'B.\xa0II only.', 'C': 'C.Both I and II.', 'D': 'D.Neither I nor\\nII.'}",D,"Senior tranches receive the lowest return because oftheir seniority in the capital
structure and any enhancements. Corporate bondsand subprime pools may have the same credit
rating, but the ABS structure willexhibit larger variation in losses.",Knowledge reasoning QA,"Collateralization, Capital structure, Credit ratings",Credit Risk Measurement and Management,difficult,text only,[],[],[],[]
10,"The single-factor model is used to examine the impact of varying default correlations based
on a credit position's beta. Each individual firm or credit, i, has a beta correlation, βi,
with the market, m. Which of the following statements most accurately describes the implication
of using a specific value m for the market parameter in the single-factor model?",[],"{'A': 'A.The conditional\\nprobability of default will be greater than the unconditional probability of', 'B': 'B.The\\nunconditional standard deviation is less than the conditional standard deviation.', 'C': ""C.Individual\\nidiosyncratic shocks, εi, are positively correlated to other firms' shocks."", 'D': ""D.Individual asset returns, aj, are independent from other firms' shocks and returns.""}",D,"Important implication of the single-factor model is thatindividual asset returns,
αi, and idiosyncratic shocks, εi are independent from other firms' shocks and returns.",Knowledge reasoning QA,"Credit risk modeling, Default correlation, Single-factor model",Credit Risk Measurement and Management,difficult,text only,[],[],[],[]
11,"At the beginning of the year, a firm bought an AA-rated corporate bond at USD 110 per USD
100 face value. Using market data, the risk manager estimates the following year-end values for
the bond based on interest rate simulations informed by the economics team: 
 
 
In addition, the risk manager estimates the 1-year transition probabilities on the AA-rated
corporate bond: 
 
What is the 1-year 95% credit VaR per USD 100 of face value closest to?",['/Volumes/Jennie/Reasoning/FinMath/data/FRMLevel2/CreditRiskMeasurementandManagement/CreditRiskMeasurementandManagement_images/11u.png'],"{'A': 'A.USD 9', 'B': 'B.USD 18', 'C': 'C.USD 30', 'D': 'D.1'}",A,"The 95% credit VaR corresponds to the unexpected loss atthe 95th percentile minus
the expected loss, or the expected future value atthe 95% loss percentile minus the current
value. Using the probabilities in thegiven ratings transition matrix, the 95% percentile
corresponds to a downgradeto BBB, at which the value of the bond would be estimated at 101.
Since cashflows for the bond are not provided, we cannot derive the precise expected
andunexpected losses, but the credit VaR (the difference) is easily derived bysubtracting the
estimated value given a BBB rating from the current value. 95%credit VaR = 110 – 101 = 9.",math reasoning QA,"Credit Value at Risk (Credit VaR), Bond Valuation, Ratings Transition Matrices",Credit Risk Measurement and Management,difficult,text only,[],[],[<PIL.PngImagePlugin.PngImageFile image mode=RGBA size=663x678 at 0x113F23250>],[]
12,"Jesse Porter, FRM, is examining the difference between risk-neutral and real-world default
probabilities. Specifically, Porter is concerned about which method to use for hedging. To help
explain the difference between the two probabilities, his colleague, Bob Evans, constructs a
hypothetical example with the following information: •  Market price of bond  = 90 • 
Liquidity  premium  =  2% •  Credit  risk  premium = 3% •  Recovery rate  =  0% • 
Risk-free rate  =  1 % •  Risk-neutral default probability = 10% Based on the data provided,
what is the real-world default probability, and which default probability (risk-neutral or
real-world) should be used for hedging purposes?",['/Volumes/Jennie/Reasoning/FinMath/data/FRMLevel2/CreditRiskMeasurementandManagement/CreditRiskMeasurementandManagement_images/12u.png'],"{'A': 'A.', 'B': 'B.无', 'C': 'C.无', 'D': 'D.无'}",A,"Risk-neutral default probability=real-world defaultprobability + credit risk
premium + liquidity premium10% = real-world default probability + 3% + 2%Real-world default
probability = 10% - 5% = 5%Risk-neutral default probabilities are usefulfor hedging
considerations while real-world default probabilities are usefulfor quantitative risk
assessment.",Math reasoning QA,"Risk-neutral probability, Real-world default probability, Hedging techniques",Credit Risk Measurement and Management,difficult,text only,[],[],[<PIL.PngImagePlugin.PngImageFile image mode=RGB size=390x159 at 0x113F23F40>],[]
13,"Assume that Smithson Inc. sells an asset to Libco Inc. and receives a debt claim for $100
million to be paid in five years. The claim from Libco is Smithson's only liability claim. The
price per share of equity for Libco is $16.10. Since there are five million shares of equity
outstanding, the total equity value of the firm is $80.5 million. Call options on the equity of
Libco with an exercise price of $10 and an expiration of one year are currently trading at
$9.09. Which of the following statements accurately describes the value of Smithson Inc.?",[],"{'A': 'A.The value of Smithson’s equity can\\nbe valued as a put option on firm value with an\nexpiration of fi', 'B': ""B.The value of Smithson's debt can\\nbe valued as the discounted value of the debt's principal,\nless th"", 'C': ""C.The value of the call option on\\nSmithson's equity can be used to estimate the volatility of\nfirm va"", 'D': 'D.When the actual value of the firm is\\nhigh, the value of the equity of the firm is more'}",B,"Statement b is true. Statement a isincorrect because equity is valued as a call
option. Statement c is incorrectbecause for the levered firm, the option on equity is a call-
on-call compoundoption and cannot be valued using the Black-Scholes-Merton Option pricingmodel.
Statement d is incorrect because when the value of the firm is low, the valueof the equity of
the firm is more volatile than when the value of the firm ishigh.",Knowledge reasoning QA,"Contingent claims analysis, Structural models of credit risk, Option pricing theory",Credit Risk Measurement and Management,difficult,text only,[],[],[],[]
14,"Terminal cash flow information for senior, junior, and equity tranches are provided as
follows. ·       The original loan pool included 100 loans with $1 million par value
each and a fixed coupon of 8%. ·       The number of surviving loans is 92.
·       The par for the senior and junior tranches is 80% and 15%, respectively. The
equity investors contributed the remaining 5%. ·       There were two defaults with
recovery rates of 40% recovered at the end of the period. ·       The value of the trust
account at the beginning of the period was $10 million earning 4% annually. ·       The
pool will terminate at the end of the fourth year. The mezzanine and equity tranche cash flows
are closest to which of the following amounts?",['/Volumes/Jennie/Reasoning/FinMath/data/FRMLevel2/CreditRiskMeasurementandManagement/CreditRiskMeasurementandManagement_images/14u.png'],"{'A': 'A.', 'B': 'B.无', 'C': 'C.无', 'D': 'D.无'}",C,"Steps to calculate terminal cash flows are as follows.1.  Total size ofcollateral
pool at origination: 100 x $1,000,000=$100,000,0002.  Senior tranche= $80,000,000    
Junior tranche= $15,000,000     Equity tranche = $5,000,0003.  Interest fromloans: 92 x 8%
x $1,000,000 = $7,360,0004.  Redemption atpar: 92 x $1,000,000 = $92,000,0005.  Recovery
infinal year: 2 x 40%x $1,000,000 = $800,0006.  Value ofovercollateralization at end of final
year: $10,000,000 x 1.04 = $10,400,0007.  Total availableto satisfy all claims =
$110,560,0008.  Senior claim=$80,000,000 < $110,560,000.  Seniorclaim is satisfied without
impairment.9.  Junior claim= $15,000,000< $110,560,000 - $80,000,000, so junior claim is
satisfied.  10. Equity claim= $110,560,000 - $80,000,000 -$15,000,000 = $15,560,000.",math reasoning QA,"Securitization, Structured Finance, Credit Risk Modeling",Credit Risk Measurement and Management,difficult,text only,[],[],[<PIL.PngImagePlugin.PngImageFile image mode=RGB size=456x137 at 0x113F23DF0>],[]
15,"Suppose a risk manager compares the potential future exposures (PFEs) for two cross-currency
swaps that have the same maturity. If one of the swaps pays a higher interest rate and the
other swap receives a higher interest rate payment, which of the following statements best
describes the risk exposures for the swaps?",[],"{'A': 'A.The swap paying\\nthe higher interest rate has less exposure.', 'B': 'B.The swap paying\\nthe higher interest rate has a lower expected gain on the notional value at\nt', 'C': 'C.Over the long\\nterm, the interest rate drift dominates the implied volatility measure causing', 'D': 'D.Over the long\\nterm, the implied volatility dominates the interest rate drift'}",C,"The swap paying the higher interest rate has a greaterexposure than the reverse
swap due to the fact that it has a significantlyhigher gain on the notional value at the
maturity of the swaps. In addition,over the long term, the interest rate drift dominates the
implied volatilitymeasure.  This causes the PFE for theswap receiving the higher interest rate
to remain relatively flat.",Knowledge reasoning QA,"Potential Future Exposure (PFE), Cross-Currency Swaps, Interest Rate Risk",Credit Risk Measurement and Management,difficult,text only,[],[],[],[]
16,"In the context of waiting for a company to default, the rate parameter, λ,in the
exponential distribution function is known as the hazard rate. This parameter indicates the
rare at which company defaults will arrive. Given a hazard rate of 0.12, what is the
conditional default probability given survival until time 2?",[],"{'A': 'A.0.2134.', 'B': 'B.0.8869.', 'C': 'C.0.1131.', 'D': 'D.\xa00.1003.'}",C,"Givena hazard rate of 0.12, the cumulative PD at time 1 would be: 1-e-0.12(1)
=0.1131. Thus, the survival probability would equal: 1 - 0.1131 = 0.8869. The cumulativePD at
time 2 would be: 1-e-0.12(2) = 0.2134. Thus, the PD from time1 to time 2 equals: 0.2134 -
0.1131 = 0.1003. The conditional PD given survivaluntil time 2 is computed as PD (from time 1
to time 2) / survival probabilityat time 1 = 0.1003 / 0.8869 = 0.1131.",math reasoning QA,"Probability distributions, Hazard rate, Survival analysis",Credit Risk Measurement and Management,difficult,text only,[],[],[],[]
17,"Large bank uses the KMV model to measure credit risk exposure. The bank has exposure to
Company X. Company X’s firm value, expected firm value, beta, and outstanding debt are shown
below. What is the distance to default and the default point for Company X? Current firm
value                         4,000 Expected firm value
                      5,000 Std. dev. expected firm
value           500 Company X Beta
                            1.4 Debt 1: Short-term
                       1,300 Debt 2: Long-term
                        1,800",['/Volumes/Jennie/Reasoning/FinMath/data/FRMLevel2/CreditRiskMeasurementandManagement/CreditRiskMeasurementandManagement_images/17u.png'],"{'A': 'A.', 'B': 'B.无', 'C': 'C.无', 'D': 'D.无'}",C,"Since the ratio of long-term-liabilities-to-short-term-liabilitiesis less than 1.5,
the following equation for default point (i.e., default threshold)will apply: Default Point =
short-term liabilities + 0.5 x long-term liabilities Default Point = 1,300 + 0.5 x 1,800 =
$2,200 The distance to default is then equal to: DD = (5,000 – 2,200) / 500 = 5.6",math reasoning QA,"Credit risk measurement, KMV model, Distance to default",Credit Risk Measurement and Management,difficult,text only,[],[],[<PIL.PngImagePlugin.PngImageFile image mode=RGB size=606x209 at 0x113F22170>],[]
18,"Which of the following statements about a cash collateralized debt obligations (CDO) special
purpose vehicle (SPV) is true?",[],"{'A': 'A.In a synthetic CDO, the SPV invests in the actual\\nsecurities that are used to generate\npayment to t', 'B': 'B.In a cash CDO, the SPV invests in the actual securities\\nthat are used to generate payment to\nthe tr', 'C': 'C.In a synthetic CDO, the SPV does not invest in the actual\\nsecurities that are used to\ngenerate paym', 'D': 'D.In a cash CDO, the SPV does not invest in the actual\\nsecurities that are used to generate'}",B,"Acash collateralized debt obligation’s (CDO) special purpose vehicle (SPV) invests
inthe actual securities that are used to generate payment to the tranches. Asynthetic CDO’s
SPV does not invest in the actual securities that are used togenerate payment to the tranches.
Instead they invest in a default swap and arisk-free bond.",Knowledge reasoning QA,"Collateralized Debt Obligations (CDOs), Special Purpose Vehicles (SPVs), Synthetic vs. Cash CDOs",Credit Risk Measurement and Management,difficult,text only,[],[],[],[]
19,"Suppose a firm has two debt issues outstanding. One is a senior debt issue that matures in
three years with a principal amount of $100 million. The other is a subordinate debt issue that
also matures in three years with a principal amount of $50 million. The annual interest rate is
5%, and the volatility of the firm value is estimated to be 15%. If interest rates decline in
the Merton model, then which of the following is true?",[],"{'A': 'A.\xa0\\nIf the firm is experiencing financial distress (low firm value), then\\nthe value of\nsenior deb', 'B': 'B.\xa0\\nIf the firm is not experiencing financial distress (high firm value),\\nthen the value of\nsenio', 'C': 'C.\xa0\\nIf the firm is experiencing financial distress (low firm value), then\\nthe value of\nsenior deb', 'D': 'D.\xa0\\nIf the firm is not experiencing financial distress (high firm value),\\nthen the value of'}",A,"When firms with subordinate debt areexperiencing financial distress (low firm
values), changes in the value ofsubordinate debt will react to changes in the model parameters
in the same wayas equity. Since equity is valued as a call option in the Merton model, a
declinein interest rates will reduce the value of equity (and subordinate debt). When firmswith
subordinate debt are not experiencing financial distress (high firm values),changes in the
value of subordinate debt will react to changes in the modelparameters in the same way as
senior debt. Since senior debt is valued as thedifference in firm value less equity valued as a
call option in the Morton model,a decline in interest rates will increase the value of senior
debt andsubordinate debt.",knowledge reasoning QA,"Merton model, Financial distress, Debt valuation",Credit Risk Measurement and Management,difficult,text only,[],[],[],[]
