question_number,question_text,image,options,answer,explanation,QA type,knowledge topics,book label,level of difficulty,question type,share_context,share_image,pil_image,pil_share_image
36,"Based on Exhibit 1 and Yamata's research on the energy sector, the shape of",[],"{'A': 'A.insurance theory.', 'B': 'B.theory of storage.', 'C': 'C.hedging pressure hypothesis.'}",B,"The Brent crude oil futures market is in a state of backwardation: The spot price
is greater than the price of near-term (i.e., nearest-to-expiration) futures contracts.
Commodities (in this case, Brent crude oil) are physical assets, not virtual assets, such as
stocks and bonds. Physical assets have to be stored, and storage incurs costs (rent, insurance,
inspections, spoilage, etc.). According to the theory of storage, a commodity that is consumed
along a value chain that allows for just-in-time delivery and use (i.e., minimal inventories
and storage) can avoid these costs. Yamata's research concluded that energy is consumed on a
real-time basis and requires minimal storage. In this situation, demand dominates supply, and
current prices are higher than futures prices (state of backwardation).",Knowledge reasoning QA,"commodity markets, theory of storage, backwardation in futures markets",Alternative Investments,easy,text + image,"[""Jamal Nabli is a portfolio manager at NextWave Commodities (NWC), a commodity-based\nhedge fund located in the United States. NWC's strategy uses a fixed-weighting scheme to\nallocate exposure among 12 commodities, and it is benchmarked against the\nThomson/Reuters/CoreCommodity CRB Index (TR/CC CRB). Nabli manages the energy and livestock\nsectors with the help of Sota Yamata, a junior analyst.Nabli and Yamata meet to discuss a\nvariety of factors that affect commodity values in the two sectors they manage. Yamata tells\nNabli the following:Statement 1 Storage costs are negatively related to futures\nprices.Statement 2 In contrast to stocks and bonds, most commodity investments are made by\nusing derivatives.Statement 3 Commodities generate future cash flows beyond what can be\nrealized through their purchase and sale.Nabli and Yamata then discuss potential new\ninvestments in the energy sector. They review Brent crude oil futures data, which are presented\nin Exhibit 1.\nYamata presents his research related to the energy sector, which has the following\nconclusions:■ Consumers have been more concerned about prices than producers have.■ Energy is\nconsumed on a real-time basis and requires minimal storage.After concluding the discussion of\nthe energy sector, Nabli reviews the performance of NWC's long position in lean hog futures\ncontracts. Nabli notes that the portfolio earned a –12% price return on the lean hog futures\nposition last year and a –24% roll return after the contracts were rolled forward. The\nposition was held with collateral equal to 100% of the position at a risk-free rate of 1.2% per\nyear.Yamata asks Nabli to clarify how the state of the futures market affects roll returns.\nNabli responds as follows:Statement 4 Roll returns are generally negative when a futures market\nis in contango.Statement 5 Roll returns are generally positive when a futures market is in\nbackwardation.As part of their expansion into new markets, NWC is considering changing its\nbenchmark index. Nabli investigates two indexes as a possible replacement. These indexes both\nuse similar weighting and rebalancing schemes. Index A includes con-tracts of commodities\ntypically in contango, whereas Index B includes contracts of commodities typically in\nbackwardation. Nabli asks Yamata how the two indexes perform relative to each other in a market\nthat is trending upward.Because of a substantial decline in drilling activity in the North Sea,\nNabli believes the price of Brent crude oil will increase more than that of heavy crude oil.\nThe actual price volatility of Brent crude oil has been lower than its expected volatility, and\nNabli expects this trend to continue. Nabli also expects the level of the ICE Brent Index to\nincrease from its current level. Nabli and Yamata discuss how to use swaps to take advantage of\nNabli's expectations. The possible positions are (1) a basis swap long on Brent crude oil and\nshort on heavy crude oil, (2) a long volatility swap on Brent crude oil, and (3) a short\nposition in an excess return swap that is based on a fixed level (i.e., the current level) of\nthe ICE Brent Index.\n ""]",['/Volumes/Jennie/Reasoning/FinMath/data/CFALevel2/AlternativeInvestments/AlternativeInvestments_images/share34-40_1.png'],[],[<PIL.PngImagePlugin.PngImageFile image mode=RGBA size=468x145 at 0x113EBDA50>]
37,The total return (annualized excluding leverage) on the lean hog futures,[],"{'A': 'A.–37.2%.', 'B': 'B.–36.0%.', 'C': 'C.–34.8%.'}",C,"The contract was held for one year, so the price return of –12% is an annualized
figure. Additionally, the –24% roll return is also annualized. Nabli's collateral return
equals 1.2% per year × 100% initial collateral investment = 1.2%. Therefore, the total return
(annualized) is calculated as follows:Total return = Price return＋Roll return＋Collateral
returnTotal return = -12%＋(-24%)＋1.26% = -34.8%.",Math reasoning QA,"Futures contracts, Total return calculation, Price return",Alternative Investments,easy,text + image,"[""Jamal Nabli is a portfolio manager at NextWave Commodities (NWC), a commodity-based\nhedge fund located in the United States. NWC's strategy uses a fixed-weighting scheme to\nallocate exposure among 12 commodities, and it is benchmarked against the\nThomson/Reuters/CoreCommodity CRB Index (TR/CC CRB). Nabli manages the energy and livestock\nsectors with the help of Sota Yamata, a junior analyst.Nabli and Yamata meet to discuss a\nvariety of factors that affect commodity values in the two sectors they manage. Yamata tells\nNabli the following:Statement 1 Storage costs are negatively related to futures\nprices.Statement 2 In contrast to stocks and bonds, most commodity investments are made by\nusing derivatives.Statement 3 Commodities generate future cash flows beyond what can be\nrealized through their purchase and sale.Nabli and Yamata then discuss potential new\ninvestments in the energy sector. They review Brent crude oil futures data, which are presented\nin Exhibit 1.\nYamata presents his research related to the energy sector, which has the following\nconclusions:■ Consumers have been more concerned about prices than producers have.■ Energy is\nconsumed on a real-time basis and requires minimal storage.After concluding the discussion of\nthe energy sector, Nabli reviews the performance of NWC's long position in lean hog futures\ncontracts. Nabli notes that the portfolio earned a –12% price return on the lean hog futures\nposition last year and a –24% roll return after the contracts were rolled forward. The\nposition was held with collateral equal to 100% of the position at a risk-free rate of 1.2% per\nyear.Yamata asks Nabli to clarify how the state of the futures market affects roll returns.\nNabli responds as follows:Statement 4 Roll returns are generally negative when a futures market\nis in contango.Statement 5 Roll returns are generally positive when a futures market is in\nbackwardation.As part of their expansion into new markets, NWC is considering changing its\nbenchmark index. Nabli investigates two indexes as a possible replacement. These indexes both\nuse similar weighting and rebalancing schemes. Index A includes con-tracts of commodities\ntypically in contango, whereas Index B includes contracts of commodities typically in\nbackwardation. Nabli asks Yamata how the two indexes perform relative to each other in a market\nthat is trending upward.Because of a substantial decline in drilling activity in the North Sea,\nNabli believes the price of Brent crude oil will increase more than that of heavy crude oil.\nThe actual price volatility of Brent crude oil has been lower than its expected volatility, and\nNabli expects this trend to continue. Nabli also expects the level of the ICE Brent Index to\nincrease from its current level. Nabli and Yamata discuss how to use swaps to take advantage of\nNabli's expectations. The possible positions are (1) a basis swap long on Brent crude oil and\nshort on heavy crude oil, (2) a long volatility swap on Brent crude oil, and (3) a short\nposition in an excess return swap that is based on a fixed level (i.e., the current level) of\nthe ICE Brent Index.\n ""]",['/Volumes/Jennie/Reasoning/FinMath/data/CFALevel2/AlternativeInvestments/AlternativeInvestments_images/share34-40_1.png'],[],[<PIL.PngImagePlugin.PngImageFile image mode=RGBA size=468x145 at 0x113EBFD30>]
38,Which of Nabli's statements about roll returns is correct?,[],"{'A': 'A.Only Statement 4', 'B': 'B.Only Statement 5', 'C': 'C.Both Statement 4 and Statement 5'}",C,"Roll returns are generally negative (positive) when the futures market is in
contango (backwardation) and zero when the futures market is flat.",Knowledge reasoning QA,"Term structure of futures, Contango and backwardation, Roll yield",Alternative Investments,easy,text + image,"[""Jamal Nabli is a portfolio manager at NextWave Commodities (NWC), a commodity-based\nhedge fund located in the United States. NWC's strategy uses a fixed-weighting scheme to\nallocate exposure among 12 commodities, and it is benchmarked against the\nThomson/Reuters/CoreCommodity CRB Index (TR/CC CRB). Nabli manages the energy and livestock\nsectors with the help of Sota Yamata, a junior analyst.Nabli and Yamata meet to discuss a\nvariety of factors that affect commodity values in the two sectors they manage. Yamata tells\nNabli the following:Statement 1 Storage costs are negatively related to futures\nprices.Statement 2 In contrast to stocks and bonds, most commodity investments are made by\nusing derivatives.Statement 3 Commodities generate future cash flows beyond what can be\nrealized through their purchase and sale.Nabli and Yamata then discuss potential new\ninvestments in the energy sector. They review Brent crude oil futures data, which are presented\nin Exhibit 1.\nYamata presents his research related to the energy sector, which has the following\nconclusions:■ Consumers have been more concerned about prices than producers have.■ Energy is\nconsumed on a real-time basis and requires minimal storage.After concluding the discussion of\nthe energy sector, Nabli reviews the performance of NWC's long position in lean hog futures\ncontracts. Nabli notes that the portfolio earned a –12% price return on the lean hog futures\nposition last year and a –24% roll return after the contracts were rolled forward. The\nposition was held with collateral equal to 100% of the position at a risk-free rate of 1.2% per\nyear.Yamata asks Nabli to clarify how the state of the futures market affects roll returns.\nNabli responds as follows:Statement 4 Roll returns are generally negative when a futures market\nis in contango.Statement 5 Roll returns are generally positive when a futures market is in\nbackwardation.As part of their expansion into new markets, NWC is considering changing its\nbenchmark index. Nabli investigates two indexes as a possible replacement. These indexes both\nuse similar weighting and rebalancing schemes. Index A includes con-tracts of commodities\ntypically in contango, whereas Index B includes contracts of commodities typically in\nbackwardation. Nabli asks Yamata how the two indexes perform relative to each other in a market\nthat is trending upward.Because of a substantial decline in drilling activity in the North Sea,\nNabli believes the price of Brent crude oil will increase more than that of heavy crude oil.\nThe actual price volatility of Brent crude oil has been lower than its expected volatility, and\nNabli expects this trend to continue. Nabli also expects the level of the ICE Brent Index to\nincrease from its current level. Nabli and Yamata discuss how to use swaps to take advantage of\nNabli's expectations. The possible positions are (1) a basis swap long on Brent crude oil and\nshort on heavy crude oil, (2) a long volatility swap on Brent crude oil, and (3) a short\nposition in an excess return swap that is based on a fixed level (i.e., the current level) of\nthe ICE Brent Index.\n ""]",['/Volumes/Jennie/Reasoning/FinMath/data/CFALevel2/AlternativeInvestments/AlternativeInvestments_images/share34-40_1.png'],[],[<PIL.PngImagePlugin.PngImageFile image mode=RGBA size=468x145 at 0x113EBEB30>]
39,The best response to Nabli's question about the relative performance of the,[],"{'A': 'A.lower than those of Index A.', 'B': 'B.the same as those of Index A.', 'C': 'C.higher than those of index A.'}",C,"Index B is likely to have higher performance than Index A in a market that is
trending upward. Indexes that (perhaps inadvertently) contain contracts that more commonly
trade in backwardation may improve forward-looking performance because this generates a
positive roll return. Similarly, indexes that contain contracts that more commonly trade in
contango may hurt performance for the same reason (i.e., negative roll return).",Knowledge reasoning QA,"Backwardation and Contango, Roll Return, Index Performance",Alternative Investments,easy,text + image,"[""Jamal Nabli is a portfolio manager at NextWave Commodities (NWC), a commodity-based\nhedge fund located in the United States. NWC's strategy uses a fixed-weighting scheme to\nallocate exposure among 12 commodities, and it is benchmarked against the\nThomson/Reuters/CoreCommodity CRB Index (TR/CC CRB). Nabli manages the energy and livestock\nsectors with the help of Sota Yamata, a junior analyst.Nabli and Yamata meet to discuss a\nvariety of factors that affect commodity values in the two sectors they manage. Yamata tells\nNabli the following:Statement 1 Storage costs are negatively related to futures\nprices.Statement 2 In contrast to stocks and bonds, most commodity investments are made by\nusing derivatives.Statement 3 Commodities generate future cash flows beyond what can be\nrealized through their purchase and sale.Nabli and Yamata then discuss potential new\ninvestments in the energy sector. They review Brent crude oil futures data, which are presented\nin Exhibit 1.\nYamata presents his research related to the energy sector, which has the following\nconclusions:■ Consumers have been more concerned about prices than producers have.■ Energy is\nconsumed on a real-time basis and requires minimal storage.After concluding the discussion of\nthe energy sector, Nabli reviews the performance of NWC's long position in lean hog futures\ncontracts. Nabli notes that the portfolio earned a –12% price return on the lean hog futures\nposition last year and a –24% roll return after the contracts were rolled forward. The\nposition was held with collateral equal to 100% of the position at a risk-free rate of 1.2% per\nyear.Yamata asks Nabli to clarify how the state of the futures market affects roll returns.\nNabli responds as follows:Statement 4 Roll returns are generally negative when a futures market\nis in contango.Statement 5 Roll returns are generally positive when a futures market is in\nbackwardation.As part of their expansion into new markets, NWC is considering changing its\nbenchmark index. Nabli investigates two indexes as a possible replacement. These indexes both\nuse similar weighting and rebalancing schemes. Index A includes con-tracts of commodities\ntypically in contango, whereas Index B includes contracts of commodities typically in\nbackwardation. Nabli asks Yamata how the two indexes perform relative to each other in a market\nthat is trending upward.Because of a substantial decline in drilling activity in the North Sea,\nNabli believes the price of Brent crude oil will increase more than that of heavy crude oil.\nThe actual price volatility of Brent crude oil has been lower than its expected volatility, and\nNabli expects this trend to continue. Nabli also expects the level of the ICE Brent Index to\nincrease from its current level. Nabli and Yamata discuss how to use swaps to take advantage of\nNabli's expectations. The possible positions are (1) a basis swap long on Brent crude oil and\nshort on heavy crude oil, (2) a long volatility swap on Brent crude oil, and (3) a short\nposition in an excess return swap that is based on a fixed level (i.e., the current level) of\nthe ICE Brent Index.\n ""]",['/Volumes/Jennie/Reasoning/FinMath/data/CFALevel2/AlternativeInvestments/AlternativeInvestments_images/share34-40_1.png'],[],[<PIL.PngImagePlugin.PngImageFile image mode=RGBA size=468x145 at 0x113EBDBA0>]
40,"Given Nabli's expectations for crude oil, the most appropriate swap position",[],"{'A': 'A.basis swap.', 'B': 'B.volatility swap.', 'C': 'C.excess return swap.'}",A,"Nabli expects the price of Brent crude oil to increase more than that of heavy
crude oil, and Nabli can take advantage of this prediction by entering into a basis swap that
is long Brent crude oil and short heavy crude oil. Nabli should take a short (not long)
position in a volatility swap to take advantage of his prediction that Brent crude oil's price
volatility will be lower than its expected volatility. Nabli should take a long (not short)
position in an excess return swap to take advantage of his expectation that the level of the
ICE Brent Index will increase faster than leading oil benchmarks.",knowledge reasoning QA,"Swap types, Commodities, Basis swaps",Alternative Investments,easy,text + image,"[""Jamal Nabli is a portfolio manager at NextWave Commodities (NWC), a commodity-based\nhedge fund located in the United States. NWC's strategy uses a fixed-weighting scheme to\nallocate exposure among 12 commodities, and it is benchmarked against the\nThomson/Reuters/CoreCommodity CRB Index (TR/CC CRB). Nabli manages the energy and livestock\nsectors with the help of Sota Yamata, a junior analyst.Nabli and Yamata meet to discuss a\nvariety of factors that affect commodity values in the two sectors they manage. Yamata tells\nNabli the following:Statement 1 Storage costs are negatively related to futures\nprices.Statement 2 In contrast to stocks and bonds, most commodity investments are made by\nusing derivatives.Statement 3 Commodities generate future cash flows beyond what can be\nrealized through their purchase and sale.Nabli and Yamata then discuss potential new\ninvestments in the energy sector. They review Brent crude oil futures data, which are presented\nin Exhibit 1.\nYamata presents his research related to the energy sector, which has the following\nconclusions:■ Consumers have been more concerned about prices than producers have.■ Energy is\nconsumed on a real-time basis and requires minimal storage.After concluding the discussion of\nthe energy sector, Nabli reviews the performance of NWC's long position in lean hog futures\ncontracts. Nabli notes that the portfolio earned a –12% price return on the lean hog futures\nposition last year and a –24% roll return after the contracts were rolled forward. The\nposition was held with collateral equal to 100% of the position at a risk-free rate of 1.2% per\nyear.Yamata asks Nabli to clarify how the state of the futures market affects roll returns.\nNabli responds as follows:Statement 4 Roll returns are generally negative when a futures market\nis in contango.Statement 5 Roll returns are generally positive when a futures market is in\nbackwardation.As part of their expansion into new markets, NWC is considering changing its\nbenchmark index. Nabli investigates two indexes as a possible replacement. These indexes both\nuse similar weighting and rebalancing schemes. Index A includes con-tracts of commodities\ntypically in contango, whereas Index B includes contracts of commodities typically in\nbackwardation. Nabli asks Yamata how the two indexes perform relative to each other in a market\nthat is trending upward.Because of a substantial decline in drilling activity in the North Sea,\nNabli believes the price of Brent crude oil will increase more than that of heavy crude oil.\nThe actual price volatility of Brent crude oil has been lower than its expected volatility, and\nNabli expects this trend to continue. Nabli also expects the level of the ICE Brent Index to\nincrease from its current level. Nabli and Yamata discuss how to use swaps to take advantage of\nNabli's expectations. The possible positions are (1) a basis swap long on Brent crude oil and\nshort on heavy crude oil, (2) a long volatility swap on Brent crude oil, and (3) a short\nposition in an excess return swap that is based on a fixed level (i.e., the current level) of\nthe ICE Brent Index.\n ""]",['/Volumes/Jennie/Reasoning/FinMath/data/CFALevel2/AlternativeInvestments/AlternativeInvestments_images/share34-40_1.png'],[],[<PIL.PngImagePlugin.PngImageFile image mode=RGBA size=468x145 at 0x113EBCDF0>]
41,Is Collin's statement about LBO firms and VC firms correct?,[],"{'A': 'A.Yes', 'B': 'B.No, because he is wrong with respect to VC firms.', 'C': 'C.No, because he is wrong with respect to LBO firms.'}",B,"LBO firms generally invest in firms with a predictable cash flow pattern (EBITDA or
EBIT growth) and experienced management teams. In contrast, venture capital firms tend to
invest in new firms and new technologies with high revenue growth. Also, VC investments tend to
be characterized as having exits that are difficult to anticipate.",knowledge reasoning QA,"Venture Capital, Leveraged Buyouts, Investment Strategies",Alternative Investments,easy,text + image,"[""Daniel Collin is a junior analyst at JRR Equity Partners, a private equity firm. Collin\nis assigned to work with Susan Tseng, a senior portfolio manager. Tseng and Collin meet to\ndiscuss existing and potential investments.Tseng starts the meeting with a discussion of LBO\nfirms and VC firms. Collin tells Tseng,LBO firms tend to invest in companies with predicable\ncash flows and experienced management teams, whereas VC firms tend to invest in companies with\nhigh EBITDA or EBIT growth and where an exit is fairly predictable.Tseng and Collin next\nanalyze a potential investment in the leveraged buyout of Stoneham Industries. Specifically,\nthey assess the expected gain if they elect to purchase all the preference shares and 90% of\nthe common equity in the LBO. Details of the LBO include the following:●The buyout requires an\ninitial investment of $10 million.●Financing for the deal includes $6 million in debt, $3.6\nmillion in preference shares that promise a 15% annual return paid at exit, and $0.4 million in\ncommon equity.The expected exit value in six years is $15 million, with an estimated reduction\nin debt of $2.8 million over the six years prior to exit.Tseng and Collin next discuss JRR's\ninvestment in Venture Holdings, a private equity fund. Selected details on the Venture Holdings\nfund include the following:●Total committed capital is $115 million.●The distribution\nwaterfall follows the deal-by-deal method, and carried interest is 20%.●On its first exit\nevent a few years ago, the fund generated a $10 million profit.●At the end of the most recent\nyear, cumulative paid-in capital was $98 million, cumulative distributions paid out to LPs were\n$28 million, and the year-end NAV, before and after distributions, was $170.52 million and\n$131.42 million, respectively.●Tseng and Collin estimate that the fund's NAV before\ndistributions will be $242.32 million at the end of next year.Finally, Tseng and Collin\nevaluate two venture capital funds for potential investment: the Squire Fund and the Treble\nFund. Both funds are in Year 7 of an estimated 10-year term. Selected data for the two funds\nare presented in Exhibit 1.\nAfter reviewing the performance data in Exhibit 1, Collin draws the following\nconclusions:Conclusion 1 The unrealized return on investment for the Squire Fund is greater\nthan the unrealized return on investment for the Treble Fund.Conclusion 2 The TVPI for the\nTreble Fund is higher than the TVPI for the Squire Fund because the Treble Fund has a higher\ngross IRR.\n ""]",['/Volumes/Jennie/Reasoning/FinMath/data/CFALevel2/AlternativeInvestments/AlternativeInvestments_images/share41-46_1.png'],[],[<PIL.PngImagePlugin.PngImageFile image mode=RGBA size=390x175 at 0x113EBFE20>]
